Campaign,Ad Group,Ad Status,Headline 1,Headline 2,Headline 3,Headline 4,Headline 5,Headline 6,Headline 7,Headline 8,Headline 9,Headline 10,Headline 11,Headline 12,Headline 13,Headline 14,Headline 15,Description 1,Description 2,Description 3,Description 4,Path 1,Path 2,Final URL,Final Mobile URL,Tracking Template,Labels
MX_Multidestino_y_Caribe_2026_05,AG1_San_Andres_Caribe,Paused,San Andrés 4D 3N,Mar de los 7 Colores,Vuelo + Hotel + Tours,Cotiza por WhatsApp,Agencia Local Confiable,Reserva con $1 USD,Itinerario a Medida,Asesoría 24/7,+10 Años en México,Reseñas Verificadas,Pago Flexible,Salidas Cada Semana,Mejor Precio Garantizado,Soporte en Español,Vacaciones Caribe,"Diseñamos tu paquete a San Andrés con vuelo, hotel y tours. Cotiza por WhatsApp.","Vacaciones inolvidables en el Mar de 7 Colores. Itinerario flexible y soporte 24/7.","Agencia colombiana con +10 años en México. Reserva con depósito mínimo de $1 USD.","Salidas semanales. Mejor precio garantizado o reembolsamos la diferencia.",san-andres,4-dias,https://colombiatours.travel/san-andres-4-dias,,,MX;SanAndres
MX_Multidestino_y_Caribe_2026_05,AG2_Multidestino_Tours,Paused,Tour Colombia 10 Días,Vuelo + Hotel + Guía,Paquete Todo Incluido,Cartagena Eje Medellín,Cotiza por WhatsApp,Vacaciones Personalizadas,Reserva con $1 USD,Asesoría 24/7,+10 Años en México,Salidas Cada Semana,Hoteles 4* y 5*,Pago en Cuotas,Mejor Precio Garantizado,Especialistas Colombia,Itinerario a Medida,"Tour completo Colombia: Cartagena, Medellín y Eje Cafetero. Vuelo + hotel + guía local.","Diseñamos tu viaje a la medida. Asesoría 24/7 en español. Reserva con depósito mínimo.","Agencia colombiana con +10 años atendiendo mexicanos. Mejor precio garantizado.","Salidas cada semana. Hoteles 4* y 5*. Soporte completo desde la reserva al regreso.",viaje,colombia,https://colombiatours.travel/agencia-de-viajes-a-colombia-para-mexicanos,,,MX;Multidestino
MX_Multidestino_y_Caribe_2026_05,AG3_Cartagena_Caribe,Paused,Cartagena Todo Incluido,Ciudad Amurallada,Vuelo + Hotel 4*,Paquete 4D 3N,Tours en Bote a Islas,Cotiza por WhatsApp,Mejor Tarifa de México,Sin Comisión Oculta,Asesoría 24/7,+10 Años Experiencia,Reserva con $1 USD,Salidas Cada Semana,Cartagena Romántica,Cartagena Familiar,Cartagena Premium,"Vuelo + hotel 4* en Ciudad Amurallada + tours a islas del Rosario. Cotiza por WhatsApp.","Cartagena de Indias 4D 3N todo incluido. Itinerario flexible y soporte 24/7 en español.","Agencia colombiana con +10 años. Mejor tarifa desde México. Reserva con $1 USD.","Sin comisión oculta. Salidas semanales. Soporte completo desde la reserva al regreso.",cartagena,4-dias,https://colombiatours.travel/cartagena,,,MX;Cartagena
MX_Multidestino_y_Caribe_2026_05,AG4_Medellin_Guatape,Paused,Tour Medellín 5 Días,Medellín y Guatapé,Eterna Primavera,Comuna 13 + Piedra Peñol,Vuelo + Hotel + Tours,Paquete Todo Incluido,Cotiza por WhatsApp,Agencia Local Medellín,+10 Años en México,Reserva con $1 USD,Asesoría 24/7,Pago Flexible,Salidas Cada Semana,Hoteles 4* y 5*,Itinerario a Medida,"Tour Medellín y Guatapé 5 días: Comuna 13, Piedra del Peñol, vuelo y hotel. WhatsApp ya.","Vive la Eterna Primavera con itinerario a medida. Agencia local con +10 años.","Reserva con $1 USD y paga el resto en cuotas. Soporte 24/7 en español.","Salidas cada semana. Hoteles 4* y 5*. Mejor precio garantizado para mexicanos.",medellin,5-dias,https://colombiatours.travel/paquetes/medellin-y-guatape-5-dias-ciudad-de-la-eterna-primavera,,,MX;Medellin
ES_Cartagena_Medellin_2026_05,AG1_Cartagena_Premium,Paused,Cartagena de Indias,Vacaciones Caribe Colombia,Circuito Premium 5D 4N,Vuelo + Hotel 4* y 5*,Ciudad Amurallada e Islas,Cotiza por WhatsApp,Agencia Colombiana,+10 Años Operando,Asesoría 24/7,Reserva con €1,Tarifa Premium,Salidas Programadas,Excursiones Privadas,Soporte en Español,Hoteles Boutique,"Vacaciones en Cartagena de Indias: vuelo, hotel 4* o 5* y excursiones a islas privadas.","Circuito premium 5D 4N. Asesoría 24/7 en español. Reserva con depósito de €1.","Agencia colombiana con +10 años atendiendo viajeros desde España. Tarifa premium.","Salidas programadas todo el año. Hoteles boutique. Soporte completo desde España.",cartagena,indias,https://colombiatours.travel/cartagena,,,ES;Cartagena
ES_Cartagena_Medellin_2026_05,AG2_Medellin_Cultural,Paused,Turismo Medellín,Medellín y Guatapé 5D,Ciudad Eterna Primavera,Vuelo + Hotel + Tours,Comuna 13 + Piedra Peñol,Cotiza por WhatsApp,Agencia Colombiana,+10 Años Experiencia,Asesoría 24/7,Reserva con €1,Tarifa Premium,Hoteles Boutique,Itinerario a Medida,Salidas Programadas,Vacaciones Inolvidables,"Turismo Medellín y Guatapé 5 días: Comuna 13, Piedra del Peñol, vuelo y hotel boutique.","Vive la Eterna Primavera con itinerario a medida. Agencia colombiana premium.","Reserva con depósito de €1 y paga en plazos. Asesoría 24/7 en español.","Salidas programadas. Hoteles boutique con desayuno. Soporte completo desde España.",turismo,medellin,https://colombiatours.travel/paquetes/medellin-y-guatape-5-dias-ciudad-de-la-eterna-primavera,,,ES;Medellin
ES_Cartagena_Medellin_2026_05,AG3_Multidestino_Premium,Paused,Vacaciones en Colombia,Agencia Viajes Colombia,Circuito Premium 15D,Tour Colombia 15 Días,Vuelo + Hotel + Tours,Cartagena Medellín Eje,Cotiza por WhatsApp,Tour Operador Colombia,+10 Años Operando,Asesoría 24/7,Reserva con €1,Hoteles 4* y 5*,Itinerario a Medida,Salidas Programadas 2026,Soporte en Español,"Circuito premium Colombia 15 días: Cartagena, Medellín, Eje Cafetero y Santa Marta.","Vuelo + hoteles 4* y 5* + excursiones privadas + asesoría 24/7 desde España.","Tour operador colombiano con +10 años. Reserva con depósito de €1 y paga en plazos.","Salidas programadas todo el año. Itinerario a medida. Soporte completo desde España.",vacaciones,colombia,https://colombiatours.travel/agencia-de-viajes-a-colombia-para-espanoles,,,ES;Multidestino
